{
  "$schema": "http://json-schema.org/draft-07/schema#",
  "type": "object",
  "properties": {
    "action": { "type": "string" },
    "ref":    { "type": "string" },
    "after":  { "type": "string" },
    "before": { "type": "string" },
    "repository": {
      "type": "object",
      "properties": {
        "id":        { "type": "integer" },
        "name":      { "type": "string" },
        "full_name": { "type": "string" },
        "owner": {
          "type": "object",
          "properties": { "login": { "type": "string" } },
          "additionalProperties": true
        }
      },
      "additionalProperties": true
    },
    "pull_request": {
      "type": "object",
      "properties": {
        "number": { "type": "integer" },
        "title":  { "type": "string" },
        "state":  { "type": "string" },
        "merged": { "type": "boolean" },
        "user": {
          "type": "object",
          "properties": { "login": { "type": "string" } },
          "additionalProperties": true
        },
        "head": {
          "type": "object",
          "properties": { "ref": { "type": "string" }, "sha": { "type": "string" } },
          "additionalProperties": true
        },
        "base": {
          "type": "object",
          "properties": { "ref": { "type": "string" }, "sha": { "type": "string" } },
          "additionalProperties": true
        }
      },
      "additionalProperties": true
    },
    "sender": {
      "type": "object",
      "properties": { "login": { "type": "string" } },
      "additionalProperties": true
    }
  },
  "additionalProperties": true
}
